{
  "$schema": "../../schema/concept.schema.json",
  "id": "s_nguoi_phap",
  "type": "structure",
  "vi": "người Pháp",
  "gloss": {
    "fr": "Français(e)",
    "en": "French person"
  },
  "register": "neutral",
  "audio": [
    {
      "voice": "mai_hcm_f",
      "src": "audio/s_nguoi_phap_mai.opus",
      "source": "native",
      "speed": "natural"
    },
    {
      "voice": "mai_hcm_f",
      "src": "audio/s_nguoi_phap_mai_slow.opus",
      "source": "native",
      "speed": "slow"
    }
  ],
  "reviewed": false,
  "examples": [
    {
      "vi": "Tôi là người Pháp.",
      "fr": "Je suis français(e).",
      "en": "I'm French."
    }
  ],
  "pos": "phrase"
}
