{
  "$schema": "../../schema/concept.schema.json",
  "id": "c_bac_si",
  "type": "word",
  "vi": "bác sĩ",
  "gloss": {
    "fr": "médecin",
    "en": "doctor"
  },
  "register": "neutral",
  "audio": [
    {
      "voice": "mai_hcm_f",
      "src": "audio/c_bac_si_mai.opus",
      "source": "native",
      "speed": "natural"
    },
    {
      "voice": "mai_hcm_f",
      "src": "audio/c_bac_si_mai_slow.opus",
      "source": "native",
      "speed": "slow"
    }
  ],
  "image": "img/people/doctor.svg",
  "reviewed": false,
  "examples": [
    {
      "vi": "Bác sĩ ơi, em đau ở đây.",
      "fr": "Docteur, j'ai mal ici.",
      "en": "Doctor, it hurts here."
    }
  ],
  "pos": "noun"
}
