{
  "$schema": "../../schema/concept.schema.json",
  "id": "c_b_don",
  "type": "word",
  "vi": "đơn",
  "tone": "ngang",
  "gloss": {
    "fr": "formulaire, demande écrite",
    "en": "form, written request"
  },
  "register": "neutral",
  "audio": [
    {
      "voice": "mai_hcm_f",
      "src": "audio/c_b_don_mai.opus",
      "source": "native",
      "speed": "natural"
    },
    {
      "voice": "mai_hcm_f",
      "src": "audio/c_b_don_mai_slow.opus",
      "source": "native",
      "speed": "slow"
    }
  ],
  "image": "img/things/form.svg",
  "reviewed": false,
  "examples": [
    {
      "vi": "Anh điền vô đơn này nha.",
      "fr": "Remplis ce formulaire, d'accord ?",
      "en": "Fill in this form, okay?"
    }
  ],
  "pos": "noun"
}
