{
  "$schema": "../../schema/concept.schema.json",
  "id": "c_trong_empty",
  "type": "word",
  "vi": "trống",
  "tone": "sac",
  "gloss": {
    "fr": "vide, libre",
    "en": "empty, free"
  },
  "register": "neutral",
  "audio": [
    {
      "voice": "mai_hcm_f",
      "src": "audio/c_trong_empty_mai.opus",
      "source": "native",
      "speed": "natural"
    },
    {
      "voice": "mai_hcm_f",
      "src": "audio/c_trong_empty_mai_slow.opus",
      "source": "native",
      "speed": "slow"
    }
  ],
  "reviewed": false,
  "pos": "adjective"
}
