{
  "$schema": "../../schema/concept.schema.json",
  "id": "c_dau_pain",
  "type": "word",
  "vi": "đau",
  "tone": "ngang",
  "gloss": {
    "fr": "avoir mal ; douleur",
    "en": "to hurt; pain"
  },
  "register": "neutral",
  "audio": [
    {
      "voice": "mai_hcm_f",
      "src": "audio/c_dau_pain_mai.opus",
      "source": "native",
      "speed": "natural"
    },
    {
      "voice": "mai_hcm_f",
      "src": "audio/c_dau_pain_mai_slow.opus",
      "source": "native",
      "speed": "slow"
    }
  ],
  "reviewed": false,
  "examples": [
    {
      "vi": "Bác sĩ ơi, em đau ở đây.",
      "fr": "Docteur, j'ai mal ici.",
      "en": "Doctor, it hurts here."
    }
  ],
  "pos": "verb"
}
