{
  "$schema": "../../schema/concept.schema.json",
  "id": "c_ten",
  "type": "word",
  "vi": "tên",
  "tone": "ngang",
  "gloss": {
    "fr": "nom, prénom",
    "en": "name"
  },
  "register": "neutral",
  "audio": [
    {
      "voice": "mai_hcm_f",
      "src": "audio/c_ten_mai.opus",
      "source": "native",
      "speed": "natural"
    },
    {
      "voice": "mai_hcm_f",
      "src": "audio/c_ten_mai_slow.opus",
      "source": "native",
      "speed": "slow"
    }
  ],
  "reviewed": false,
  "examples": [
    {
      "vi": "Tôi tên là Lan.",
      "fr": "Je m'appelle Lan.",
      "en": "My name is Lan."
    }
  ]
}
