{
  "$schema": "../../schema/concept.schema.json",
  "id": "c_b_hoi_festival",
  "type": "word",
  "vi": "hội",
  "tone": "nang",
  "gloss": {
    "fr": "fête traditionnelle ; association",
    "en": "festival; association"
  },
  "register": "neutral",
  "audio": [
    {
      "voice": "mai_hcm_f",
      "src": "audio/c_b_hoi_festival_mai.opus",
      "source": "native",
      "speed": "natural"
    },
    {
      "voice": "mai_hcm_f",
      "src": "audio/c_b_hoi_festival_mai_slow.opus",
      "source": "native",
      "speed": "slow"
    }
  ],
  "reviewed": false
}
