{
  "$schema": "../../schema/concept.schema.json",
  "id": "c_b_nghi_think",
  "type": "word",
  "vi": "nghĩ",
  "tone": "nga",
  "gloss": {
    "fr": "penser",
    "en": "to think"
  },
  "register": "neutral",
  "audio": [
    {
      "voice": "mai_hcm_f",
      "src": "audio/c_b_nghi_think_mai.opus",
      "source": "native",
      "speed": "natural"
    },
    {
      "voice": "mai_hcm_f",
      "src": "audio/c_b_nghi_think_mai_slow.opus",
      "source": "native",
      "speed": "slow"
    }
  ],
  "reviewed": false
}
