{
  "$schema": "../../schema/concept.schema.json",
  "id": "c_sau_six",
  "type": "word",
  "vi": "sáu",
  "tone": "sac",
  "gloss": {
    "fr": "six",
    "en": "six"
  },
  "register": "neutral",
  "audio": [
    {
      "voice": "mai_hcm_f",
      "src": "audio/c_sau_six_mai.opus",
      "source": "native",
      "speed": "natural"
    },
    {
      "voice": "mai_hcm_f",
      "src": "audio/c_sau_six_mai_slow.opus",
      "source": "native",
      "speed": "slow"
    }
  ],
  "reviewed": false,
  "examples": [
    {
      "vi": "Anh cho em nghỉ thứ sáu nha.",
      "fr": "Tu me laisses prendre vendredi, d'accord ?",
      "en": "Can I take Friday off, okay?"
    }
  ],
  "pos": "numeral"
}
