{
  "$schema": "../../schema/concept.schema.json",
  "id": "c_anh",
  "type": "word",
  "vi": "anh",
  "tone": "ngang",
  "gloss": {
    "fr": "grand frère ; toi/vous (homme un peu plus âgé)",
    "en": "older brother; you (slightly older man)"
  },
  "register": "neutral",
  "audio": [
    {
      "voice": "mai_hcm_f",
      "src": "audio/c_anh_mai.opus",
      "source": "native",
      "speed": "natural"
    },
    {
      "voice": "mai_hcm_f",
      "src": "audio/c_anh_mai_slow.opus",
      "source": "native",
      "speed": "slow"
    }
  ],
  "image": "img/people/anh.svg",
  "reviewed": false,
  "examples": [
    {
      "vi": "Dạ, em cảm ơn anh.",
      "fr": "Oui, merci (à un homme un peu plus âgé).",
      "en": "Yes, thank you (to a slightly older man)."
    }
  ]
}
