{
  "$schema": "../../schema/concept.schema.json",
  "id": "c_chong",
  "type": "word",
  "vi": "chồng",
  "tone": "huyen",
  "gloss": {
    "fr": "mari",
    "en": "husband"
  },
  "register": "neutral",
  "audio": [
    {
      "voice": "mai_hcm_f",
      "src": "audio/c_chong_mai.opus",
      "source": "native",
      "speed": "natural"
    },
    {
      "voice": "mai_hcm_f",
      "src": "audio/c_chong_mai_slow.opus",
      "source": "native",
      "speed": "slow"
    }
  ],
  "image": "img/family/husband.svg",
  "reviewed": false
}
