{
  "$schema": "../../schema/concept.schema.json",
  "id": "c_may_cloud",
  "type": "word",
  "vi": "mây",
  "tone": "ngang",
  "gloss": {
    "fr": "nuage",
    "en": "cloud"
  },
  "register": "neutral",
  "audio": [
    {
      "voice": "mai_hcm_f",
      "src": "audio/c_may_cloud_mai.opus",
      "source": "native",
      "speed": "natural"
    },
    {
      "voice": "mai_hcm_f",
      "src": "audio/c_may_cloud_mai_slow.opus",
      "source": "native",
      "speed": "slow"
    }
  ],
  "reviewed": false,
  "pos": "noun"
}
