{
  "$schema": "../../schema/concept.schema.json",
  "id": "s_nha_toi_co",
  "type": "structure",
  "vi": "Nhà tôi có…",
  "gloss": {
    "fr": "Chez moi, il y a…",
    "en": "At my home there is/are…"
  },
  "register": "neutral",
  "audio": [
    {
      "voice": "mai_hcm_f",
      "src": "audio/s_nha_toi_co_mai.opus",
      "source": "native",
      "speed": "natural"
    },
    {
      "voice": "mai_hcm_f",
      "src": "audio/s_nha_toi_co_mai_slow.opus",
      "source": "native",
      "speed": "slow"
    }
  ],
  "reviewed": false,
  "examples": [
    {
      "vi": "Nhà tôi có hai con mèo.",
      "fr": "Chez moi, il y a deux chats.",
      "en": "At my home there are two cats."
    }
  ],
  "pos": "phrase"
}
