{
  "$schema": "../../schema/concept.schema.json",
  "id": "c_b_dung_right",
  "type": "word",
  "vi": "đúng",
  "tone": "sac",
  "gloss": {
    "fr": "juste, vrai, correct",
    "en": "right, correct"
  },
  "register": "neutral",
  "audio": [
    {
      "voice": "mai_hcm_f",
      "src": "audio/c_b_dung_right_mai.opus",
      "source": "native",
      "speed": "natural"
    },
    {
      "voice": "mai_hcm_f",
      "src": "audio/c_b_dung_right_mai_slow.opus",
      "source": "native",
      "speed": "slow"
    }
  ],
  "reviewed": false
}
