{
  "$schema": "../../schema/concept.schema.json",
  "id": "c_b_phong_bi",
  "type": "word",
  "vi": "phong bì",
  "gloss": {
    "fr": "enveloppe",
    "en": "envelope"
  },
  "register": "neutral",
  "audio": [
    {
      "voice": "mai_hcm_f",
      "src": "audio/c_b_phong_bi_mai.opus",
      "source": "native",
      "speed": "natural"
    },
    {
      "voice": "mai_hcm_f",
      "src": "audio/c_b_phong_bi_mai_slow.opus",
      "source": "native",
      "speed": "slow"
    }
  ],
  "reviewed": false,
  "pos": "noun"
}
